{
  "apiVersion": "game.platform/v1alpha1",
  "kind": "Command",
  "metadata": {
    "requestId": "01JTEST00000000000000000000",
    "correlationId": "01JTEST00000000000000000001",
    "gameId": "arena",
    "environment": "dev",
    "definitionRevision": 1
  },
  "actor": { "type": "player", "id": "player-1" },
  "spec": { "operation": "inventory.list", "arguments": {} }
}
