{
  "apiVersion": "game.platform/v1alpha1",
  "kind": "Command",
  "metadata": { "requestId": "01JITEM0000000000000000001", "correlationId": "01JITEM0000000000000000002", "gameId": "arena", "environment": "dev", "definitionRevision": 1 },
  "actor": { "type": "server", "id": "match-server-1" },
  "spec": { "operation": "inventory.grant", "arguments": { "playerId": "player-1", "itemId": "iron_sword", "quantity": 2 } }
}
