{
  "apiVersion": "game.platform/v1alpha1",
  "kind": "Command",
  "metadata": { "requestId": "01JWALLET000000000000000005", "correlationId": "01JWALLET000000000000000006", "gameId": "arena", "environment": "dev", "definitionRevision": 1 },
  "actor": { "type": "player", "id": "player-1" },
  "spec": { "operation": "wallet.get", "arguments": { "playerId": "player-1", "currency": "coins" } }
}
