{
  "apiVersion": "game.platform/v1alpha1",
  "kind": "Command",
  "metadata": { "requestId": "01JWALLET000000000000000001", "correlationId": "01JWALLET000000000000000002", "gameId": "arena", "environment": "dev", "definitionRevision": 1 },
  "actor": { "type": "server", "id": "match-server-1" },
  "spec": { "operation": "wallet.credit", "arguments": { "playerId": "player-1", "currency": "coins", "amount": 100 } }
}
